,text,date,amusement_parks,ferris_wheels,water_parks,miniature_parks,baths_and_saunas,climbing,stadiums,winter_sports,natural_springs,water,nature_reserves,beaches,railway_stations,dams,mints,mineshafts,science_museums,churches,cathedrals,monasteries,synagogues,hindu_temples,mosques,archaeology,castles,fortified_towers,bunkers,military_museums,battlefields,war_graves,cemeteries,mausoleums,crypts,monuments,tumuluses,wall_painting,fountains,sculptures,gardens_and_parks,archaeological_museums,art_galleries,biographical_museums,history_museums,local_museums,national_museums,fashion_museums,planetariums,zoos,aquariums,skyscrapers,towers,historic_architecture,bridges
147,"Jestem pasjonatem historii i sztuki, z zamiłowaniem do zwiedzania miejsc z bogatym dziedzictwem kulturowym. Moje hobby to fotografowanie zabytków i uczestnictwo w spektaklach plenerowych. Wolny czas najchętniej spędzam w miejscach oferujących unikalne doświadczenia kulturowe i artystyczne.",{'Data': 'Moja wycieczka odbędzie się od 15 lipca do 30 lipca 2023 roku.'},2,3,2,3,2,1,2,1,3,4,4,2,3,2,1,2,3,4,5,3,4,2,1,4,5,3,2,3,2,3,4,2,1,4,2,3,3,4,4,4,5,3,5,4,5,3,2,3,3,2,4,4,4
148,"Jestem miłośnikiem sportu i aktywności fizycznej, z zamiłowaniem do aktywnego zwiedzania. Moje hobby to jogging po parkach miejskich i uczestnictwo w różnorodnych wydarzeniach kulturalnych. Wolny czas najchętniej spędzam w miejscach oferujących unikalne atrakcje sportowe i artystyczne.",{'Data': 'Moja wycieczka odbędzie się od 8 czerwca do 23 czerwca 2023 roku.'},3,2,3,2,4,3,5,3,2,3,2,2,3,2,1,1,3,2,3,1,1,1,1,2,3,2,1,2,1,2,2,1,1,3,1,2,2,2,4,2,3,2,3,3,4,2,2,3,2,3,3,3,4
149,"Jestem miłośnikiem natury i geografii, z zainteresowaniem dla różnorodności krajobrazów miejskich. Moje hobby to obserwowanie otoczenia naturalnego i eksploracja miejsc oferujących urozmaicone krajobrazy. Wolny czas najchętniej spędzam w miejscach z bogatym otoczeniem przyrodniczym.",{'Data': 'Moja wycieczka odbędzie się od 12 sierpnia do 27 sierpnia 2023 roku.'},2,3,2,1,2,1,2,1,3,4,5,2,2,3,1,1,2,3,3,2,1,1,1,3,4,2,1,2,1,2,2,1,1,3,2,2,3,2,4,3,2,1,3,2,4,1,2,3,2,1,3,3,3
150,Jestem fanem nowoczesnych technologii z zamiłowaniem do podróży. Moje hobby to eksploracja nowych miejsc i korzystanie z nowatorskich rozwiązań technologicznych. Wolny czas najchętniej spędzam w miejscach oferujących unikalne doświadczenia z zakresu nowoczesnych technologii.,{'Data': 'Moja wycieczka odbędzie się od 5 września do 20 września 2023 roku.'},3,4,2,2,3,2,3,2,3,3,3,2,4,2,1,2,5,3,3,2,2,1,1,3,4,3,2,4,2,3,3,2,1,3,2,3,3,4,4,4,4,2,4,3,4,3,4,3,3,4,5,3,4
151,Jestem miłośnikiem sztuki ulicznej i historii miast. Moje hobby to malowanie murali i eksploracja miejsc z unikalną architekturą. Wolny czas najchętniej spędzam w miejscach oferujących ciekawe motywy do fotografowania oraz bogatą historię i dziedzictwo kulturowe.,{'Data': 'Moja wycieczka odbędzie się od 10 lipca do 25 lipca 2023 roku.'},2,3,1,2,2,1,2,1,3,3,2,2,3,2,1,1,2,3,3,2,2,1,1,2,3,3,2,2,1,2,2,1,1,4,2,5,3,3,4,2,5,2,4,3,4,3,2,3,2,2,4,4,4
152,"Jestem pasjonatem akwarystyki, fascynuje mnie życie podwodne. Moje hobby to hodowla i obserwacja różnorodnych gatunków ryb i roślin akwariowych. Wolny czas najchętniej spędzam w miejscach oferujących fascynujące akwaria i bogactwo podwodnego świata.",{'Data': 'Moja wycieczka odbędzie się od 15 września do 30 września 2023 roku.'},2,3,4,1,2,1,1,1,2,3,3,2,2,2,1,1,3,2,2,2,1,1,1,2,2,1,1,2,1,1,1,1,1,2,1,1,2,2,3,2,1,1,2,2,2,1,1,5,5,1,3,2,2
153,"Jestem pasjonatem wędkarstwa, uwielbiam spędzać czas nad wodą i łowić ryby. Moje hobby to poszukiwanie najlepszych łowisk i odkrywanie różnorodnych gatunków ryb. Wolny czas najchętniej spędzam w miejscach oferujących doskonałe warunki do wędkowania i piękne krajobrazy nad wodą.",{'Data': 'Moja wycieczka odbędzie się od 5 maja do 20 maja 2023 roku.'},1,1,5,1,1,1,1,1,3,5,4,2,1,4,1,1,1,1,1,1,1,1,1,2,2,1,1,1,1,1,1,1,1,1,1,1,1,1,2,1,1,1,2,2,2,1,1,2,2,1,2,2,3
154,"Jestem miłośnikiem kultury i sztuki, a moje zainteresowania skupiają się głównie wokół teatru i spektakli plenerowych. Kocham odkrywać nowe miejsca z rozwiniętą sceną kulturalną i unikalnymi widowiskami. Wolny czas najchętniej spędzam w miejscach, gdzie mogę czerpać inspirację z różnorodnych form sztuki.",{'Data': 'Moja wycieczka odbędzie się od 10 lipca do 25 lipca 2023 roku.'},2,3,1,1,1,1,1,1,2,2,2,1,2,1,1,1,4,3,3,2,2,1,1,2,2,1,1,2,1,1,1,1,1,3,1,4,2,3,3,3,5,2,3,3,4,2,1,2,1,2,4,3,2
155,"Jestem fanem nowych technologii i uwielbiam eksplorować miejsca, gdzie innowacje idą w parze z pięknem architektury. W wolnym czasie fascynuje mnie świat programowania, a podróże traktuję jako okazję do odkrywania nowoczesnych rozwiązań i inspirujących projektów.",{'Data': 'Moja wycieczka odbędzie się od 15 sierpnia do 30 sierpnia 2023 roku.'},2,3,1,1,1,1,1,1,2,2,2,1,3,1,1,1,5,2,2,1,1,1,1,2,3,1,1,2,1,1,1,1,1,2,1,3,2,2,4,3,4,2,3,3,4,2,1,1,1,4,5,3,3
156,"Jestem miłośnikiem książek i sztuki, a moje zainteresowania skupiają się głównie na literaturze i rysunku mangi. Wolny czas najchętniej spędzam w klimatycznych kawiarniach z dobrym czytadłem lub pracując nad własnymi projektami rysunkowymi.",{'Data': 'Moja wycieczka odbędzie się od 5 września do 20 września 2023 roku.'},1,2,1,1,1,1,1,1,2,1,2,1,2,1,1,1,3,2,2,1,1,1,1,1,2,1,1,2,1,1,1,1,1,2,1,2,2,2,3,3,4,2,3,3,3,2,1,1,1,2,3,2,2
157,Jestem pasjonatem nauki i techniki. Moje hobby to eksperymentowanie i zgłębianie tajników nowoczesnych technologii. Wolny czas najchętniej spędzam w muzeach nauki i techniki oraz na aktywnościach związanych z poznawaniem nowych dziedzin nauki.,{'Data': 'Moja wycieczka odbędzie się od 10 lipca do 25 lipca 2023 roku.'},2,3,1,1,1,1,1,1,2,1,3,1,3,1,1,2,5,2,2,1,1,1,1,2,3,1,1,4,2,2,2,1,1,3,1,2,2,2,3,3,3,2,4,3,4,2,1,1,1,3,4,3,3
158,"Jestem fanem nowych technologii. Moje zainteresowania skupiają się głównie na świecie cyfrowym, programowaniu i innowacjach. Wolny czas najchętniej spędzam na eksploracji nowoczesnych miejsc, w których można doświadczyć przyszłościowej technologii.",{'Data': 'Moja wycieczka odbędzie się od 15 sierpnia do 30 sierpnia 2023 roku.'},3,4,2,1,1,1,2,1,2,1,2,1,4,1,1,1,5,2,2,1,1,1,1,1,3,2,1,3,1,2,2,1,1,3,1,2,2,2,3,4,3,2,4,3,4,2,3,2,2,4,4,2,3
159,"Jestem fanem książek i sztuki. Moje zainteresowania skupiają się na literaturze oraz tworzeniu i odbiorze sztuki w różnych formach. Wolny czas najchętniej spędzam w muzeach, galeriach sztuki oraz przy czytaniu dobrej książki.",{'Data': 'Moja wycieczka odbędzie się od 5 września do 20 września 2023 roku.'},2,3,1,2,1,1,1,1,2,1,2,1,2,1,1,1,3,3,3,2,2,1,1,2,3,1,1,1,1,2,2,1,1,3,1,2,2,3,3,3,5,3,3,3,4,5,1,1,1,2,3,3,2
160,"Jestem pasjonatem nauki i techniki. Moje zainteresowania skupiają się na odkrywaniu tajemnic wszechświata oraz nowinkach technologicznych. Wolny czas najchętniej spędzam w muzeach nauki, planetariach i miejscach, gdzie mogę zgłębiać wiedzę z dziedziny technologii.",{'Data': 'Moja wycieczka odbędzie się od 10 lipca do 25 lipca 2023 roku.'},2,3,1,1,1,1,2,1,2,1,3,1,2,1,1,1,5,2,2,1,1,1,1,2,2,1,1,3,1,2,2,1,1,3,1,2,2,2,3,4,2,2,4,3,4,2,5,1,2,3,4,2,3
161,"Jestem fanem nowych technologii i nowoczesnych rozwiązań. Moje zainteresowania skupiają się na odkrywaniu innowacyjnych projektów oraz korzystaniu z najnowszych gadżetów. Wolny czas najchętniej spędzam w muzeach nauki, parkach technologicznych i miejscach, gdzie mogę eksplorować nowe technologie.",{'Data': 'Moja wycieczka odbędzie się od 15 sierpnia do 30 sierpnia 2023 roku.'},2,3,1,1,1,1,2,1,2,1,2,1,2,1,1,1,5,2,2,1,1,1,1,2,2,1,1,3,1,2,2,1,1,3,1,2,2,2,3,4,2,2,4,3,4,2,5,1,2,3,4,2,3
162,"Jestem miłośnikiem teatru i kultury. Moje zainteresowania skupiają się na uczestnictwie w spektaklach plenerowych oraz odkrywaniu miejsc z rozwiniętą sceną kulturalną. Wolny czas najchętniej spędzam w teatrach, muzeach sztuki oraz miejscach, gdzie mogę czerpać inspirację z różnorodnych wydarzeń kulturalnych.",{'Data': 'Moja wycieczka odbędzie się od 5 września do 20 września 2023 roku.'},2,3,1,1,1,1,2,1,2,1,2,1,2,1,1,1,3,3,4,2,2,2,2,3,3,2,1,2,1,2,2,2,1,3,1,4,2,3,2,3,5,2,4,3,4,2,2,2,2,3,4,3,3
163,"Jestem pasjonatem sportu i aktywności fizycznej. Moje zainteresowania skupiają się na joggingu po parkach miejskich oraz uczestnictwie w wydarzeniach sportowych. Wolny czas najchętniej spędzam na aktywnościach fizycznych, a zwiedzanie miejsc łączę z ruchem i zdrowym stylem życia.",{'Data': 'Moja wycieczka odbędzie się od 10 lipca do 25 lipca 2023 roku.'},2,3,1,2,3,2,5,2,1,2,3,1,2,1,1,1,2,2,2,1,1,1,1,2,2,1,1,3,2,2,2,1,1,2,1,1,1,1,4,2,2,1,3,2,3,1,1,2,2,1,3,2,3
164,Jestem miłośnikiem historii sztuki i fotografii. Moje zainteresowania skupiają się na odkrywaniu ukrytych zakątków miast oraz zwiedzaniu miejsc z bogatym dziedzictwem kulturowym. Wolny czas najchętniej spędzam w muzeach sztuki i miejscach oferujących ciekawe motywy do fotografowania.,{'Data': 'Moja wycieczka odbędzie się od 15 sierpnia do 30 sierpnia 2023 roku.'},1,3,1,1,1,2,1,1,2,2,4,1,3,2,1,1,2,4,5,3,2,1,1,3,4,2,1,2,2,2,3,2,1,3,1,1,1,2,3,3,5,2,4,3,4,1,2,1,1,1,4,5,3
165,Jestem entuzjastą nowych technologii i fascynuje mnie świat programowania. W wolnym czasie najchętniej zajmuję się projektowaniem aplikacji oraz eksploracją miejsc związanych z innowacjami technologicznymi. Interesuję się również astronomią i uwielbiam obserwować gwiazdy.,{'Data': 'Moja wycieczka odbędzie się od 10 lipca do 25 lipca 2023 roku.'},3,2,1,2,1,3,2,1,2,1,3,1,2,1,1,2,5,1,1,1,1,1,1,2,3,2,1,4,1,2,1,1,1,2,1,1,1,1,3,3,2,1,4,3,4,1,4,1,1,4,4,2,3
166,Jestem miłośnikiem teatru i fotografii. Interesuje mnie różnorodność kulturowa oraz unikalne spektakle plenerowe. Wolny czas najchętniej spędzam na fotografowaniu architektury i scen kulturalnych. Pragnę odkrywać nieznane zakątki miast i zanurzać się w ich atmosferze.,{'Data': 'Moja wycieczka odbędzie się od 15 sierpnia do 30 sierpnia 2023 roku.'},2,3,1,2,2,1,2,1,2,2,2,1,2,1,1,1,2,3,4,2,3,1,1,3,2,2,1,1,1,2,2,1,1,2,1,3,2,2,4,3,4,2,4,3,4,2,1,2,2,3,4,3,3
167,"Jestem fanem akwarystyki i wędkarstwa. Zafascynowany różnorodnością podwodnego świata oraz spokojem wędkowania. Wolny czas najchętniej spędzam w bliskości wód, zarówno w akwariach, jak i nad jeziorami czy rzekami.",{'Data': 'Moja wycieczka odbędzie się od 10 lipca do 25 lipca 2023 roku.'},1,2,4,1,3,1,2,1,3,5,4,2,1,4,1,1,2,1,1,1,1,1,1,2,2,2,1,1,1,1,2,1,1,2,1,1,3,2,3,2,1,1,2,1,2,1,1,3,5,1,2,2,3
168,Jestem miłośnikiem teatru i aktywności fizycznej. Interesuję się różnorodnością kulturową i sceną kulturalną. Wolny czas najchętniej spędzam uczestnicząc w spektaklach plenerowych i uprawiając jogging po parkach miejskich.,{'Data': 'Moja wycieczka odbędzie się od 5 sierpnia do 20 sierpnia 2023 roku.'},2,3,2,2,4,3,3,1,2,3,3,1,2,2,2,2,4,3,4,2,3,1,2,3,3,2,1,3,2,2,3,3,1,3,1,4,2,2,4,3,4,3,4,3,4,3,2,2,2,3,4,3,3
169,Jestem fanem akwarystyki. Moje hobby to obserwowanie życia podwodnego. Wolny czas najchętniej spędzam w akwariach i nad morzem.,{'Data': 'Moja wycieczka odbędzie się od 10 lipca do 25 lipca 2023 roku.'},2,3,4,1,3,1,2,1,3,4,5,5,2,3,1,1,2,1,1,2,1,1,1,2,2,1,1,2,1,2,2,1,1,2,1,1,2,1,4,2,1,2,2,2,2,1,1,4,5,2,3,2,3
170,"Jestem pasjonatem sportu, który preferuje aktywność fizyczną podczas zwiedzania. Moje hobby to jogging po parkach miejskich. Wolny czas najchętniej spędzam na świeżym powietrzu, odkrywając nowe miejsca podczas biegania.",{'Data': 'Moja wycieczka odbędzie się od 15 sierpnia do 30 sierpnia 2023 roku.'},3,2,2,2,4,4,5,3,2,3,4,2,3,2,1,1,2,1,1,2,1,1,1,3,3,2,1,3,4,3,2,1,1,3,2,1,2,1,4,3,2,2,3,3,3,2,1,3,2,4,3,3,4
171,"Jestem miłośnikiem teatru, który lubi uczestniczyć w spektaklach plenerowych. Moje hobby to obcowanie z kulturą i sztuką. Wolny czas najchętniej spędzam na wydarzeniach kulturalnych i przedstawieniach teatralnych.",{'Data': 'Moja wycieczka odbędzie się od 10 lipca do 25 lipca 2023 roku.'},3,4,1,2,2,1,2,1,1,2,3,1,2,1,1,1,3,4,4,3,2,1,1,2,3,2,1,2,1,2,2,2,1,3,1,4,3,2,4,2,4,3,4,3,4,3,1,2,1,3,4,4,2
172,"Jestem pasjonatem nowych technologii i fanem akwarystyki. Uwielbiam eksplorować różnorodność krajobrazów miejskich, zwłaszcza miejsc z unikalną architekturą. Moje hobby to również fotografia, zwłaszcza przyrodnicza.",{'Data': 'Moja wycieczka odbędzie się od 5 września do 20 września 2023 roku.'},3,4,2,1,2,1,3,1,2,3,4,2,3,2,1,1,5,3,3,2,2,1,1,2,4,3,1,3,1,2,2,2,1,4,1,3,3,3,4,3,4,3,4,3,4,3,4,3,3,4,5,3,3
173,"Jestem fanem wędkarstwa i aktywności na wodzie. Interesuje mnie ekologia i zrównoważony rozwój miast. Uwielbiam odkrywać ukryte zakątki miast, zwłaszcza te z urozmaiconym otoczeniem naturalnym.",{'Data': 'Moja wycieczka odbędzie się od 10 lipca do 25 lipca 2023 roku.'},2,3,5,2,4,1,3,1,4,5,5,3,2,4,1,2,3,2,2,2,1,1,1,3,4,3,2,3,1,2,2,3,2,3,1,2,3,2,5,4,3,2,4,3,4,1,3,4,4,2,3,2,3
174,"Jestem pasjonatem teatru i spektakli plenerowych. Interesuje mnie kultura i historia miast, zwłaszcza ich architektura. Lubię też uczestniczyć w wydarzeniach kulturalnych.",{'Data': 'Moja wycieczka odbędzie się od 5 sierpnia do 20 sierpnia 2023 roku.'},2,3,1,2,2,1,2,1,2,3,3,1,3,2,1,1,3,4,4,3,4,1,1,3,4,3,1,3,1,2,2,3,2,4,1,3,3,3,4,4,5,3,4,3,4,2,2,2,2,3,4,4,3
175,Jestem miłośnikiem historii i architektury. Interesuję się lokalną kuchnią i lubię uczestniczyć w wydarzeniach kulturalnych. Wolę spokojne miejsca nad morzem.,{'Data': 'Moja wycieczka odbędzie się od 10 lipca do 25 lipca 2023 roku.'},2,3,1,2,2,1,3,1,3,4,4,4,3,3,2,3,4,5,5,4,3,1,1,4,5,4,2,4,2,3,3,4,3,4,2,3,4,4,5,5,4,3,5,4,5,3,2,3,3,4,5,5,4
176,Jestem miłośnikiem kultury i historii. Interesuję się teatrem i lokalną kuchnią. Wolę spokojne miejsca nad rzeką.,{'Data': 'Moja wycieczka odbędzie się od 15 sierpnia do 30 sierpnia 2023 roku.'},2,3,2,2,2,1,3,1,3,4,3,2,4,3,2,3,4,5,4,3,3,1,1,4,5,4,2,4,3,3,3,4,3,4,2,3,4,4,5,4,5,3,5,4,5,3,2,3,3,4,5,5,4
177,Jestem entuzjastą historii i architektury. Interesuję się także lokalną kuchnią. Wolę spokojne miejsca z bogatym dziedzictwem kulturowym.,{'Data': 'Moja wycieczka odbędzie się od 10 lipca do 20 lipca 2023 roku.'},2,3,1,2,2,1,4,1,3,4,4,2,4,3,2,3,4,5,4,3,4,1,1,4,5,4,2,4,3,3,3,4,3,4,2,3,4,4,5,4,5,3,5,4,5,3,2,3,3,4,5,5,4
178,Jestem pasjonatem historii i kultury. Interesuję się także lokalną kuchnią. Preferuję spokojne miejsca z bogatym dziedzictwem kulturowym.,{'Data': 'Moja wycieczka odbędzie się od 15 sierpnia do 25 sierpnia 2023 roku.'},3,4,2,3,3,2,4,2,4,4,5,3,4,3,3,4,5,5,5,4,4,1,1,4,5,4,2,4,3,3,4,4,3,4,3,3,4,4,5,4,5,4,5,4,5,3,3,4,3,4,5,5,4
179,Jestem miłośnikiem nowoczesnej architektury i kultury street artu. Interesuję się również lokalnymi miejscami kulinarnymi.,{'Data': 'Moja wycieczka odbędzie się od 10 lipca do 20 lipca 2023 roku.'},3,4,2,3,3,4,3,2,3,4,3,2,3,2,3,3,4,3,4,3,4,1,1,3,4,3,2,3,3,2,3,3,2,4,2,5,3,4,4,3,5,3,4,3,4,3,3,3,3,5,5,3,4
180,Jestem miłośnikiem zwierząt i interesuję się różnorodnością przyrody. Chciałbym odwiedzić zoo podczas mojej podróży.,{'Data': 'Planuję wycieczkę w okresie od 15 sierpnia do 25 sierpnia 2023 roku.'},3,3,3,2,2,2,2,1,2,3,5,2,3,2,1,2,2,2,1,1,1,1,1,2,1,1,1,2,1,1,1,1,1,2,1,1,2,2,4,2,1,1,1,1,2,1,1,5,4,2,3,2,2
181,Jestem miłośnikiem historii i architektury. Interesuje mnie bogate dziedzictwo kulturowe oraz zabytki historyczne.,{'Data': 'Planuję wycieczkę w okresie od 10 lipca do 20 lipca 2023 roku.'},2,3,2,2,2,1,3,1,2,3,4,1,4,3,1,2,4,5,4,3,2,1,1,3,5,4,2,4,3,3,3,2,3,4,2,2,3,3,3,4,4,3,5,4,5,2,2,1,1,3,4,5,4
182,"Jestem miłośnikiem architektury sakralnej, zwłaszcza klasztorów i kościołów. Interesuje mnie historia religii i sztuki sakralnej.",{'Data': 'Planuję wycieczkę w okresie od 15 września do 25 września 2023 roku.'},1,2,1,1,1,1,1,1,2,1,2,1,2,1,1,1,1,5,4,5,2,1,1,1,2,2,1,1,1,1,2,2,1,2,1,1,1,1,1,1,2,1,2,1,2,1,1,1,1,1,2,3,2
183,"Interesuję się sztuką i historią, zwłaszcza narodową. Chciałbym odwiedzić muzeum narodowe, aby zgłębić wiedzę o kulturze danego kraju.",{'Data': 'Planuję wycieczkę w okresie od 10 października do 20 października 2023 roku.'},1,2,1,1,1,1,1,1,2,1,2,1,2,1,1,1,2,3,2,1,1,1,1,1,2,1,1,1,1,1,1,1,1,1,1,1,1,1,1,1,4,2,5,3,5,2,1,1,1,1,2,3,2
184,"Jestem miłośnikiem historii, zwłaszcza zamków i fortyfikacji. Chciałbym odwiedzić miejsca, które mają bogatą historię związaną z architekturą obronną.",{'Data': 'Planuję wycieczkę w okresie od 15 lipca do 30 lipca 2023 roku.'},1,2,1,1,1,1,1,1,1,1,1,1,2,1,1,1,1,2,1,2,1,1,1,1,5,3,1,2,1,1,1,1,1,2,1,1,1,1,1,1,3,1,4,2,3,1,1,1,1,1,2,4,2
185,"Jestem miłośnikiem zamków i fortyfikacji. Fascynuje mnie historia architektury obronnej, dlatego planuję odwiedzić miejsca związane z tym tematem.",{'Data': 'Planuję wycieczkę w okresie od 10 sierpnia do 25 sierpnia 2023 roku.'},1,2,1,1,1,1,1,1,1,1,1,1,2,1,1,1,1,2,1,3,1,1,1,1,5,4,1,2,1,1,1,1,1,2,1,1,1,1,1,1,3,1,4,2,3,1,1,1,1,1,3,4,2
186,"Jestem entuzjastą zamków i fortyfikacji. Fascynuje mnie historia architektury obronnej, dlatego planuję odwiedzić miejsca związane z tym tematem.",{'Data': 'Planuję wycieczkę w okresie od 15 lipca do 30 lipca 2023 roku.'},1,2,1,1,1,1,1,1,1,1,1,1,2,1,1,1,1,2,1,3,1,1,1,1,5,4,4,3,3,2,1,2,1,3,1,1,1,1,1,1,3,2,4,2,4,1,1,1,1,1,3,4,2
187,Jestem entuzjastą parków rozrywki i atrakcji. Lubię aktywny wypoczynek oraz miejsca oferujące rozrywkę i emocje.,{'Data': 'Planuję wycieczkę w okresie od 15 sierpnia do 30 sierpnia 2023 roku.'},5,4,4,3,4,3,4,2,3,3,4,4,3,3,2,2,3,1,1,1,1,1,1,2,3,2,2,3,2,1,1,1,1,2,2,1,3,2,5,2,3,2,3,2,3,2,2,4,4,1,4,3,2
188,Jestem entuzjastą parków rozrywki i atrakcji. Lubię aktywny wypoczynek oraz miejsca oferujące rozrywkę i emocje.,{'Data': 'Planuję wycieczkę w okresie od 15 lipca do 30 lipca 2023 roku.'},5,4,5,4,4,3,4,3,3,4,4,4,3,3,2,2,3,2,2,2,1,1,1,2,4,3,2,3,2,1,1,1,1,2,2,1,4,3,5,3,3,2,4,3,4,2,2,5,5,2,5,4,3
189,Jestem miłośnikiem cmentarzy i miejsc o charakterze mauzolealnym. Interesuje mnie historia oraz architektura grobów i mauzoleów.,{'Data': 'Planuję wycieczkę w okresie od 10 września do 20 września 2023 roku.'},2,3,2,2,2,1,2,1,1,1,2,1,3,2,1,1,2,3,3,4,3,1,2,2,2,2,1,1,1,4,5,5,3,3,2,1,1,2,2,2,2,2,3,3,3,1,1,1,1,1,3,3,2
190,Jestem entuzjastą parków rozrywki i podobnych atrakcji. Cenię sobie miejsca oferujące różnorodne i emocjonujące atrakcje dla odwiedzających.,{'Data': 'Planuję wycieczkę w okresie od 5 lipca do 15 lipca 2023 roku.'},5,4,4,3,4,3,4,3,3,3,4,4,3,3,2,3,4,3,3,2,2,2,2,3,3,3,2,3,2,2,3,2,3,3,2,3,4,3,4,3,3,2,3,3,4,2,3,5,4,3,4,3,3
191,"Jestem miłośnikiem kultury i historii. Preferuję miejsca z bogatym dziedzictwem kulturowym, takie jak muzea, zabytki architektoniczne, a także ciche miejsca, gdzie mogę cieszyć się spokojem i urodą natury.",{'Data': 'Planuję wycieczkę w okresie od 10 sierpnia do 20 sierpnia 2023 roku.'},3,4,3,3,3,2,3,2,4,4,5,3,4,4,2,3,5,5,4,4,3,3,3,4,5,4,3,4,3,3,4,4,4,4,3,3,3,4,4,5,4,3,5,4,5,3,4,3,3,3,4,4,4
192,"Jestem entuzjastą przyrody i ekologii. Interesują mnie miejsca związane z zrównoważonym rozwojem, pięknem krajobrazów naturalnych oraz parkami narodowymi, gdzie mogę obcować z różnorodnością przyrody.",{'Data': 'Planuję wycieczkę w okresie od 5 września do 15 września 2023 roku.'},2,3,2,2,2,3,2,1,4,5,5,2,3,4,1,2,2,3,2,3,2,2,2,3,4,3,2,3,2,3,3,3,2,3,2,2,2,3,3,3,2,2,3,3,4,1,2,4,3,1,3,3,3
193,"Jestem miłośnikiem kultury i historii. Interesują mnie miejsca z bogatym dziedzictwem kulturowym, muzea, zabytkowe obiekty architektoniczne oraz lokalna kuchnia. Cenię sobie także spokojne spacery po parkach i ogrodach.",{'Data': 'Planuję wycieczkę w okresie od 10 października do 20 października 2023 roku.'},2,3,2,2,3,2,3,1,3,4,3,2,3,3,2,3,4,4,3,4,3,2,2,4,5,4,3,4,3,4,4,4,3,4,3,2,3,3,4,4,4,3,5,4,5,2,3,3,3,2,4,4,3
194,"Jestem miłośnikiem przyrody i aktywności na świeżym powietrzu. Interesują mnie parki narodowe, góry, jeziora oraz miejsca oferujące możliwość aktywnego wypoczynku. Cenię sobie także spokojne zakątki, gdzie mogę zrelaksować się z dala od zgiełku miejskiego.",{'Data': 'Planuję wycieczkę w okresie od 15 lipca do 30 lipca 2023 roku.'},2,3,2,2,3,4,3,2,4,4,5,3,2,4,2,3,2,3,2,3,2,2,2,3,4,3,2,3,3,3,3,2,2,3,2,2,3,3,4,3,3,2,3,3,3,2,2,4,3,2,3,3,3
195,"Jestem miłośnikiem historii i kultury. Interesują mnie miejsca z bogatym dziedzictwem kulturowym, muzea, zabytkowe obiekty architektoniczne oraz lokalna kuchnia. Cenię sobie spokojne spacery po historycznych uliczkach oraz możliwość uczestnictwa w lokalnych wydarzeniach kulturalnych.",{'Data': 'Planuję wycieczkę w okresie od 1 września do 15 września 2023 roku.'},2,3,2,2,3,2,3,2,3,3,3,2,3,3,2,2,4,5,4,4,3,2,2,4,4,3,2,4,3,4,3,3,2,4,3,2,3,3,3,4,4,3,5,4,5,3,2,2,2,3,4,4,3
196,"Jestem entuzjastą przyrody i aktywnego wypoczynku. Interesują mnie miejsca z pięknymi krajobrazami, możliwość uprawiania sportów outdoorowych oraz atrakcje związane z przyrodą. Cenię sobie spokojne wędrówki i aktywność fizyczną na świeżym powietrzu.",{'Data': 'Planuję wycieczkę w okresie od 1 września do 15 września 2023 roku.'},2,2,2,2,2,4,3,4,3,5,5,3,2,4,2,3,2,2,2,2,2,2,2,3,4,4,3,3,4,3,3,3,2,3,3,2,2,3,4,3,3,2,3,3,3,2,2,3,2,2,3,3,3
197,"Jestem młodym turystą z zamiłowaniem do kultury, sztuki oraz nowoczesnych atrakcji. Szukam miejsc pełnych energii, z ciekawą architekturą i bogatą sceną kulturalną. Cenię sobie zarówno zabytki historyczne, jak i nowoczesne obiekty, a także artystyczne wydarzenia.",{'Data': 'Planuję wycieczkę w okresie od 1 sierpnia do 15 sierpnia 2023 roku.'},4,3,3,2,3,2,3,2,3,4,3,3,4,3,2,3,4,3,3,3,2,2,2,3,4,3,2,3,3,2,3,3,2,4,2,4,3,4,3,4,5,3,4,3,4,3,3,3,3,4,4,4,4
198,"Jestem młodą turystką, uwielbiającą przyrodę, kulturę i sztukę. Poszukuję miejsc pełnych zielonych terenów, fascynujących muzeów oraz lokalnych atrakcji kulturowych. Interesują mnie zarówno miejsca historyczne, jak i nowoczesne obiekty, a także malownicze krajobrazy.",{'Data': 'Planuję wycieczkę w okresie od 1 lipca do 15 lipca 2023 roku.'},3,4,3,2,3,2,3,2,4,4,5,4,3,4,2,3,4,4,4,3,3,3,2,4,4,3,2,4,3,3,3,3,2,4,3,4,3,4,4,4,5,4,4,4,5,3,3,4,4,4,5,4,4
199,"Jestem turystką, która uwielbia spokojne miejsca z dala od zgiełku miejskiego. Interesuje mnie głównie przyroda, architektura oraz lokalna kultura. Poszukuję miejsc, gdzie mogę zrelaksować się w otoczeniu pięknych krajobrazów i jednocześnie cieszyć się unikatowymi zabytkami i tradycjami.",{'Data': 'Planuję wycieczkę w okresie od 15 sierpnia do 31 sierpnia 2023 roku.'},2,3,2,2,3,2,2,2,4,4,5,3,3,4,2,3,3,4,4,3,3,3,2,4,4,3,2,3,3,3,3,3,2,4,3,3,3,4,4,4,4,3,4,4,4,3,3,3,3,2,4,4,4
200,"Jestem turystką, która kocha odkrywać różnorodne miejsca, zwłaszcza te związane z historią i kulturą. Szukam miejsc, które oferują ciekawe doświadczenia kulturowe i artystyczne. Preferuję spokojne otoczenie i unikatowe atrakcje, które pozostawiają niezapomniane wrażenia.",{'Data': 'Planuję wycieczkę w okresie od 15 sierpnia do 31 sierpnia 2023 roku.'},3,4,3,3,4,3,3,3,4,4,5,4,4,4,3,4,4,5,5,4,4,4,3,5,5,4,3,4,4,4,4,4,3,5,4,4,4,5,5,5,5,4,5,5,5,4,4,4,4,3,5,5,5
201,"Jestem turystką, która uwielbia poznawać różne kultury i smaki świata. Poszukuję miejsc, które oferują wyjątkowe doświadczenia kulinarne oraz fascynującą historię. Preferuję miejsca z bogatym dziedzictwem kulturowym i atmosferą sprzyjającą odkrywaniu lokalnych tradycji.",{'Data': 'Planuję podróż w okresie od 1 lipca do 15 lipca 2023 roku.'},4,4,3,3,3,3,4,2,3,4,5,4,3,3,3,3,4,5,5,4,4,3,3,4,4,3,2,4,3,3,4,3,2,4,3,4,4,4,4,4,4,3,4,4,4,3,3,4,3,3,4,5,4
202,"Jestem turystką, która kocha przyrodę i zawsze poszukuje spokojnych miejsc do relaksu. Interesuje mnie zwiedzanie parków narodowych, ogrodów botanicznych, a także miejsc, gdzie mogę obserwować różnorodność krajobrazów i unikalne zjawiska przyrodnicze.",{'Data': 'Planuję podróż w okresie od 1 sierpnia do 15 sierpnia 2023 roku.'},2,3,2,2,2,2,2,1,3,4,5,3,2,3,2,2,3,3,3,2,2,3,3,3,3,2,2,3,2,2,3,2,1,3,2,3,3,3,4,3,3,2,3,3,3,2,2,3,2,2,3,3,3
203,"Jestem turystką o zamiłowaniu do kultury i sztuki. Cenię sobie zwiedzanie muzeów, galerii sztuki, teatrów i miejsc kulturalnych. Interesują mnie także urokliwe kawiarnie i miejsca, gdzie mogę doświadczyć lokalnej kuchni.",{'Data': 'Planuję podróż w okresie od 10 lipca do 25 lipca 2023 roku.'},2,3,2,2,2,1,2,1,2,2,2,2,3,2,1,1,4,4,4,3,3,3,3,3,4,3,2,3,2,2,3,3,2,3,2,4,3,4,3,4,5,3,4,3,4,3,2,2,2,2,3,4,3
204,"Jestem turystką o wielkim zamiłowaniu do przyrody i aktywności fizycznej. Najbardziej cenię sobie miejsca z pięknymi krajobrazami, parki narodowe, górskie szlaki oraz możliwość aktywnego spędzania czasu na świeżym powietrzu.",{'Data': 'Planuję podróż w okresie od 15 sierpnia do 30 sierpnia 2023 roku.'},2,2,2,2,1,4,2,3,3,4,5,1,2,3,1,2,2,1,1,2,1,1,1,3,3,3,2,2,3,3,2,1,1,2,3,1,2,1,2,2,1,2,3,2,2,1,1,3,3,2,4,2,3
205,"Jestem turystką, która kocha kulturę i sztukę. Moje podróże skupiają się głównie na zwiedzaniu muzeów, galerii sztuki, teatrów i innych miejsc oferujących unikalne doświadczenia kulturalne.",{'Data': 'Planuję podróż w okresie od 1 lipca do 15 lipca 2023 roku.'},1,2,1,1,1,1,2,1,1,1,1,1,1,1,2,1,5,4,4,3,4,2,2,3,3,2,1,3,2,2,3,2,1,3,2,1,1,2,3,3,5,4,4,3,5,4,1,1,1,2,4,4,3
206,"Jestem turystką, która uwielbia naturę i aktywność fizyczną. Podczas podróży najbardziej cenię sobie miejsca oferujące piękne krajobrazy, parki narodowe, szlaki turystyczne oraz atrakcje związane z outdoorowymi aktywnościami.",{'Data': 'Planuję podróż w okresie od 1 września do 15 września 2023 roku.'},2,1,1,2,2,4,3,2,3,5,5,3,2,3,1,2,1,1,1,1,1,1,1,2,3,2,1,2,1,1,1,1,1,2,1,1,1,1,2,2,1,1,2,2,1,1,1,4,3,1,3,2,1
