,text,date,amusement_parks,ferris_wheels,water_parks,miniature_parks,baths_and_saunas,climbing,stadiums,winter_sports,natural_springs,water,nature_reserves,beaches,railway_stations,dams,mints,mineshafts,science_museums,churches,cathedrals,monasteries,synagogues,hindu_temples,mosques,archaeology,castles,fortified_towers,bunkers,military_museums,battlefields,war_graves,cemeteries,mausoleums,crypts,monuments,tumuluses,wall_painting,fountains,sculptures,gardens_and_parks,archaeological_museums,art_galleries,biographical_museums,history_museums,local_museums,national_museums,fashion_museums,planetariums,zoos,aquariums,skyscrapers,towers,historic_architecture,bridges
56,"Podobno jeść w spokojnych warunkach, spożywając potrawy z różnych regionów świata i wypróbowywanie nowych żywności, szczególnie tych, które zawierają przepisy polskie, włoskie, hiszpańskie i meksykańskie.Nie lubię odkrywać historycznych miejsc lub odwiedzanie architektury, ale raczej preferuje bardziej niekonwencjonalne i wyjątkowe doświadczenia..Gotowanie i palenie są popularnymi rozrywkami wśród mnie, a ja preferuję aktywną rozrywkę, jednocześnie cieszę się występami tanecznymi w salach balowych",Od 13 do 17 listopada,4,4,2,1,2,4,1,0,0,3,3,2,0,0,1,1,2,1,1,0,0,0,0,2,2,1,1,3,1,2,0,0,0,2,1,3,3,2,4,2,1,1,2,1,3,1,1,3,3,1,2,2,2
57,"Książki, nauka, sztuka i muzyka to wszystko, co uważam za przyjemne..Lubię też spędzać wolny czas z przyjaciółmi na grach planszowych, angażować się w luźne spotkania lub po prostu samotność, aby rozwinąć swoje hobby",od 8 do 13 stycznia ,4,2,1,1,0,4,2,2,4,5,4,2,4,2,4,4,5,5,5,5,5,5,5,5,5,4,4,3,3,4,4,4,5,3,3,5,3,5,4,5,5,4,4,3,3,2,5,4,3,3,2,5,3
58,"Lubię też grać w pasywne i aktywne gry, pokoje ucieczki, ośrodki naukowe, miejsca z pięknymi widokami, wycieczki rowerowe, wanny z hydromasażem i restauracje, które oferują lokalne potrawy lub specjalną kuchnię zagraniczną, taką jak Indian lub Azja.Lubię gry planszowe, książki karne i prawdziwe podcasty przestępcze.",Od 1 lipca do 7 lipca,5,3,3,2,5,3,1,1,1,4,5,5,2,3,5,5,5,1,4,4,3,3,3,5,5,4,5,4,4,2,1,3,3,0,1,1,3,1,1,5,2,5,5,3,5,4,5,5,5,5,5,5,3
59,"Urodziłem się z brązową odznaką jazdy w 2009 roku, ale pociągi dla srebrnej odznaki również z powodu tego pościgu..Większość czasu spędzam na podróży, w tym kilka sportów śnieżnych.Od najmłodszych lat jego miłość do zwierząt była stałym strumieniem aktywności.Lubi konie, psy (moja ulubiona rasa), koty, papugi, węże i miniaturowe króliki.Mam dwa psy, które są członkami mojej rodziny;To najlepsi towarzysze podczas tej podróży",Wycieczka odbędzie się w dniu 16 listopada 2023 roku od godziny 7:00 do godziny 22:30,2,4,5,1,2,1,1,1,1,3,5,4,3,2,2,5,2,2,2,2,2,1,1,4,3,3,3,1,5,5,5,3,3,1,1,2,0,1,2,3,2,3,2,1,1,3,4,5,5,5,5,2,2
60,"Jestem zainteresowany doświadczeniem różnych sportów artystycznych, w tym ich oglądaniem i obserwowaniem ich historii.Lubię również projektowanie i stylizację ubrań do wypoczynku lub podróżowanie do popularnych miejsc turystycznych, takich jak parki łyżwiarskie, parki wspinaczkowe/upadające i ziplines.","za tydzień, od wieczora 17 listopada do południa 19 listopada",5,2,5,3,3,4,2,5,0,3,1,3,1,1,1,2,2,2,3,0,1,1,1,3,3,2,3,1,0,0,0,2,3,3,2,4,3,2,2,3,4,2,2,2,3,5,4,4,4,5,5,3,5
61,".Grając w RPG, gry planszowe, LARP jest jednym z moich zainteresowań.Lubię odwiedzać muzea i zabytki podczas eksploracji miast;teren górski;Rozkoszowanie się hamburgerów i restauracji z tradycyjnymi polskimi składnikami.Lubię też czytać książki w wolnym czasie w kręgach naukowych",Dwa tygodnie w lipcu,1,1,1,1,3,1,1,2,3,3,3,4,2,2,3,3,4,3,4,3,3,4,4,2,4,4,3,3,2,3,3,3,3,2,2,4,3,3,3,3,4,4,4,5,4,3,5,4,4,3,5,5,3
62,"Lubię grać w gry obejmujące karty i kości, a także matematykę i fizykę.Ponadto interesuję się graniem w gry planszowe i gry komputerowe.",od 2 do 10 sierpnia,3,0,4,1,1,1,0,1,1,4,4,2,0,0,0,3,3,3,5,2,4,4,4,3,4,4,2,1,1,1,1,2,2,1,1,3,2,2,1,3,3,1,2,2,2,0,4,2,2,1,1,3,1
63,"Mój czas wolny poświęcony jest gotowaniu i spalaniu, a także tańcu na tańce balowe..Preferuję odkrywanie interesujących i mniej konwencjonalnych opcji, jeśli chodzi o posiłki, szczególnie w miejscach z akcentem hiszpańskiego lub włoskiego stylu życia;Ponadto moją preferowaną działalnością jest odwiedzanie historycznych miejsc i zabytków, które nie są turystyczne",Od 13 do 17 listopada,4,4,2,1,2,4,1,0,0,3,3,2,0,0,1,1,2,1,1,0,0,0,0,2,2,1,1,3,1,2,0,0,0,2,1,3,3,2,4,2,1,1,2,1,3,1,1,3,3,1,2,2,2
64,".Mam pasję do sztuki, przyrody, architektury i jedzenia",Moim marzeniem jechać jest na wycieczkę  do włoszech z moimi przyjaciółmi w wakacje. Data to przełom lipca i sierpnia rok 2025 na około tydzień do 2 tygodni.,1,0,5,3,5,0,2,4,4,5,4,5,3,2,3,2,3,5,4,5,1,1,1,2,5,2,2,4,3,2,2,2,2,3,3,4,4,5,4,2,5,2,3,2,5,3,4,5,5,2,2,5,5
65,"Mam pasję do historii i literatury, szczególnie klasycznych dzieł..Lubię odwiedzać muzea historycznych i muzea sztuki, a także podróżować i odkrywać określone miejsca.Najbardziej interesują mnie okres międzywojennych i młodych polskich, czytając i pisanie książek","Za tydzień, od 17 do 19 listopada",0,2,1,1,4,0,1,1,2,1,2,3,1,1,2,4,4,3,3,1,2,3,2,4,3,2,1,0,3,2,2,2,2,1,2,1,2,3,2,4,5,5,5,4,5,5,2,5,4,2,2,5,2
66,"Lubię odkrywać nowe miejsca poprzez ryzykowne zajęcia, takie jak zwiedzanie lub odwiedzanie atrakcji, które zapewniają mi ekscytację i jestem przyjazny mieszkańcom.Najbardziej imponujące zabytki miasta to ten, w którym nocne zachody słońca zawsze wydają się spektakularne..Moje zainteresowania leżą w sporcie i muzyce, a moje hobby obejmują granie w perkusję i granie w gry komputerowe",Od 1 do 6 grudnia.,5,5,4,1,4,5,5,3,0,3,2,4,0,3,1,4,4,0,0,0,0,2,2,0,3,3,4,1,1,0,0,0,1,0,0,0,0,0,0,0,4,1,2,2,0,5,4,1,2,5,1,1,3
67,"Lubię łączyć zarówno aktywne, jak i pasywne zajęcia rekreacyjne, a najbardziej poszukiwane miejsca turystyczne to te, które pomagają mi zdobyć nowe umiejętności lub zainteresowania..Moje zainteresowania obejmują różne obszary, takie jak filozofia, literatura fantasy, sport i gitara",W przyszłą sobotę i niedzielę.,4,2,4,3,3,4,5,4,2,3,3,2,1,2,3,4,5,4,4,4,4,4,4,4,5,4,4,3,4,3,3,2,2,4,3,3,4,4,4,3,4,4,4,3,4,3,5,5,5,4,3,5,3
68,"Jestem pasjonatem zarówno tematów muzycznych, jak i medycznych..Lubię też długie spacery i posiłki w kawiarniach.Moje preferowane rozrywki grają na instrumentach i śpiewać, spędzają czas na spacerze po domu, rozmowy z przyjaciółmi, odkrywanie muzyki i miejsc sztuki oraz cieszenie się malowniczymi widokami",15-16 grudnia ,0,2,0,0,1,0,1,2,3,3,3,3,1,2,1,1,2,2,2,2,1,0,0,1,2,1,0,0,0,0,0,0,0,0,1,2,2,2,3,1,1,0,1,2,1,0,3,2,2,0,3,3,2
69,"Większość czasu spędzam w różnych dyscyplinach, w tym poświęcanie się firmie dla zwierząt..Rozwinął także powinowactwo do koni, psów, kotów, papug, gołębi węża i jest żonaty z psem o imieniu „Bob”.Mam pasję do jazdy konnej i robię to od dzieciństwa.Jego miłość do zwierząt była stałym tematem przez całe życie.Ukończyłem swoją odznakę jazdy i obecnie trenuję szkolenie dla srebrnej odznaki, a także uczestniczę w seminariach, w których dowiem się o tej działalności",Wycieczka odbędzie się w dniu 16 listopada 2023 roku od godziny 7:00 do godziny 22:30,2,4,5,1,2,1,1,1,1,3,5,4,3,2,2,5,2,2,2,2,2,1,1,4,3,3,3,1,5,5,5,3,3,1,1,2,0,1,2,3,2,3,2,1,1,3,4,5,5,5,5,2,2
70,"Lubię jeździć na rowerze w wolnym czasie, zwiedzać atrakcje turystyczne w tradycyjny sposób, takie jak chodzenie po zamkach, aktywność podczas jedzenia w barach mlecznych i zabieranie łuków.","W czwartek rano, od 15 do 30 listopada",2,1,3,1,3,5,3,4,3,4,2,4,5,2,2,4,5,5,3,4,3,2,2,4,5,5,5,5,5,5,5,3,2,3,2,5,4,2,2,5,3,2,1,0,2,4,3,5,4,3,2,4,2
71,"Jeśli chodzi o wybór posiłków, często wybieram lokalne specjały lub potrawy egzotyczne..Jestem szczególnie zainteresowany studiowaniem fizyki, matematyki i historii.Ilekroć mam wolny czas, lubię czytać książki, rysować i uczyć się nowych języków.Jednak znajduję również przyjemność z aktywnego uczestnictwa, ale również szukam spokojnych chwil, spędzając czas z rodziną lub przyjaciółmi",24 listopada ,5,3,5,3,5,0,2,2,1,1,1,2,2,2,3,4,5,1,1,1,1,1,1,2,5,5,5,5,5,5,3,4,4,5,4,3,4,3,4,2,0,0,2,1,1,0,5,4,4,1,1,1,1
72,".Moje preferowane rozrywki to restauracja, mechanika samochodowa, naprawy komputerów, gra na gitarze i spędzanie czasu z rodziną",W środe od 13 do 18 czerwca ,5,3,4,3,5,4,4,3,4,5,3,2,5,3,4,5,3,5,5,5,4,2,3,2,5,5,5,5,5,4,5,3,3,4,2,4,5,5,3,4,3,4,2,3,5,3,3,5,3,5,3,4,5
73,"Najbardziej imponujące zabytki miasta to te, które oferują oszałamiające wrażenia nocne.Ponadto lubię odkrywać nowe miejsca w niekonwencjonalny sposób, jednocześnie ciesząc się emocjami związanymi z odwiedzaniem ekscytujących atrakcji i spotykania świeżych twarzy..Jako osoba, która lubi sport i muzykę, mam powinowactwo do grania na perkusji i grania w gry komputerowe",Od 1 do 6 grudnia.,5,5,4,1,4,5,5,3,0,3,2,4,0,3,1,4,4,0,0,0,0,2,2,0,3,3,4,1,1,0,0,0,1,0,0,0,0,0,0,0,4,1,2,2,0,5,4,1,2,5,1,1,3
74,"Ponadto lubię kuchnię śródziemnomorską i nie mam żadnych preferencji dotyczących aktywności fizycznej lub wolności..Jestem pasjonatem odkrywania nowych technologii i problemów naukowych, a także poznaniem historii miejsc wraz z atrakcjami, które oferują praktyczne możliwości uczenia się",Od najbliższego piątku do poniedziałku.,2,3,1,1,1,0,1,1,1,2,3,1,2,3,3,3,4,1,1,2,1,1,2,3,4,4,3,3,2,2,1,1,3,1,3,0,0,0,0,1,3,2,2,3,1,0,3,2,2,5,2,1,2
